[
  {
    "domain": "bzat.com",
    "registrar": "DREAMHOST",
    "creation_date": "2003-05-20T11:04:23.00Z",
    "expiration_date": "2025-05-20T18:04:23.00Z",
    "updated_date": "2024-04-19T07:40:26.00Z",
    "name_servers": [
      "NS1.DREAMHOST.COM",
      "NS2.DREAMHOST.COM",
      "NS3.DREAMHOST.COM"
    ],
    "status": "ok https://www.icann.org/epp#ok",
    "raw_data": "\r\n\r\nDomain Name: bzat.com\r\nRegistry Domain ID: 98129467_DOMAIN_COM-VRSN\r\nRegistrar WHOIS Server: WHOIS.DREAMHOST.COM\r\nRegistrar URL: WWW.DREAMHOST.COM\r\nUpdated Date: 2024-04-19T07:40:26.00Z\r\nCreation Date: 2003-05-20T11:04:23.00Z\r\nRegistrar Registration Expiration Date: 2025-05-20T18:04:23.00Z\r\nRegistrar: DREAMHOST\r\nRegistrar IANA ID: 431\r\nDomain Status: ok https://www.icann.org/epp#ok\r\nRegistrant Name: REDACTED FOR PRIVACY\r\nRegistrant Organization: REDACTED FOR PRIVACY\r\nRegistrant Street: REDACTED FOR PRIVACY\r\nRegistrant Street: \r\nRegistrant City: REDACTED FOR PRIVACY\r\nRegistrant State/Province: wa\r\nRegistrant Postal Code: REDACTED FOR PRIVACY\r\nRegistrant Country: US\r\nRegistrant Phone: REDACTED FOR PRIVACY\r\nRegistrant Phone Ext: \r\nRegistrant Fax: REDACTED FOR PRIVACY\r\nRegistrant Email: https://tieredaccess.com/contact/3c5ce1fa-9be0-4872-acd0-8fabb0b9f87d\r\nAdmin Name: REDACTED FOR PRIVACY\r\nAdmin Organization: REDACTED FOR PRIVACY\r\nAdmin Street: REDACTED FOR PRIVACY\r\nAdmin Street: \r\nAdmin City: REDACTED FOR PRIVACY\r\nAdmin State/Province: REDACTED FOR PRIVACY\r\nAdmin Postal Code: REDACTED FOR PRIVACY\r\nAdmin Country: REDACTED FOR PRIVACY\r\nAdmin Phone: REDACTED FOR PRIVACY\r\nAdmin Phone Ext: \r\nAdmin Fax: REDACTED FOR PRIVACY\r\nAdmin Email: REDACTED FOR PRIVACY\r\nTech Name: REDACTED FOR PRIVACY\r\nTech Organization: REDACTED FOR PRIVACY\r\nTech Street: REDACTED FOR PRIVACY\r\nTech Street: \r\nTech City: REDACTED FOR PRIVACY\r\nTech State/Province: REDACTED FOR PRIVACY\r\nTech Postal Code: REDACTED FOR PRIVACY\r\nTech Country: REDACTED FOR PRIVACY\r\nTech Phone: REDACTED FOR PRIVACY\r\nTech Phone Ext: \r\nTech Fax: REDACTED FOR PRIVACY\r\nTech Email: REDACTED FOR PRIVACY\r\nName Server: NS1.DREAMHOST.COM\r\nName Server: NS2.DREAMHOST.COM\r\nName Server: NS3.DREAMHOST.COM\r\nDNSSEC: unsigned\r\nRegistrar Abuse Contact Email: DOMAIN-ABUSE@DREAMHOST.COM\r\nRegistrar Abuse Contact Phone: +1.7148729370\r\nURL of the ICANN WHOIS Data Problem Reporting System: HTTPS://ICANN.ORG/WICF\r\n>>> Last update of WHOIS database: 2025-03-26T07:40:17.00Z <<<\r\n\r\nFor more information on Whois status codes, please visit https://icann.org/epp\r\n\r\nDreamHost whois server terms of service: http://whois.dreamhost.com/\r\n\r\nDreamHost is a global Web hosting and cloud services provider with over 375,000 customers and 1.2 million blogs, websites and apps hosted. The company offers a wide spectrum of Web hosting and cloud services including Shared Hosting, Virtual Private Servers (VPS), Dedicated Server Hosting, Domain Name Registration, the cloud storage service, DreamObjects, and the cloud computing service DreamCompute. Please visit http://DreamHost.com for more information."
  },
  {
    "domain": "qhnu.com",
    "registrar": "Name.com, Inc.",
    "creation_date": "2006-05-14T01:34:31Z",
    "expiration_date": "2025-05-14T01:34:31Z",
    "updated_date": "2025-02-26T20:05:51Z",
    "name_servers": [
      "ns1.eftydns.com",
      "ns2.eftydns.com"
    ],
    "status": "clientTransferProhibited https://www.icann.org/epp#clientTransferProhibited",
    "raw_data": "Domain Name: QHNU.COM \nRegistry Domain ID: 447969852_DOMAIN_COM-VRSN \nRegistrar WHOIS Server: whois.name.com \nRegistrar URL: http://www.name.com \nUpdated Date: 2025-02-26T20:05:51Z \nCreation Date: 2006-05-14T01:34:31Z \nRegistrar Registration Expiration Date: 2025-05-14T01:34:31Z \nRegistrar: Name.com, Inc. \nRegistrar IANA ID: 625 \nReseller:  \nDomain Status: clientTransferProhibited https://www.icann.org/epp#clientTransferProhibited \nRegistry Registrant ID: Not Available From Registry \nRegistrant Name: Redacted For Privacy \nRegistrant Organization: Domain Protection Services, Inc. \nRegistrant Street: PO Box 1769  \nRegistrant City: Denver \nRegistrant State/Province: CO \nRegistrant Postal Code: 80201 \nRegistrant Country: US \nRegistrant Phone: +1.7208009072 \nRegistrant Fax: +1.7209758725 \nRegistrant Email: https://www.name.com/contact-domain-whois/qhnu.com \nRegistry Admin ID: Not Available From Registry \nAdmin Name: Redacted For Privacy \nAdmin Organization: Domain Protection Services, Inc. \nAdmin Street: PO Box 1769  \nAdmin City: Denver \nAdmin State/Province: CO \nAdmin Postal Code: 80201 \nAdmin Country: US \nAdmin Phone: +1.7208009072 \nAdmin Fax: +1.7209758725 \nAdmin Email: https://www.name.com/contact-domain-whois/qhnu.com \nRegistry Tech ID: Not Available From Registry \nTech Name: Redacted For Privacy \nTech Organization: Domain Protection Services, Inc. \nTech Street: PO Box 1769  \nTech City: Denver \nTech State/Province: CO \nTech Postal Code: 80201 \nTech Country: US \nTech Phone: +1.7208009072 \nTech Fax: +1.7209758725 \nTech Email: https://www.name.com/contact-domain-whois/qhnu.com \nName Server: ns1.eftydns.com \nName Server: ns2.eftydns.com \nDNSSEC: unSigned \nRegistrar Abuse Contact Email: abuse@name.com \nRegistrar Abuse Contact Phone: +1.7203101849 \nURL of the ICANN WHOIS Data Problem Reporting System: http://wdprs.internic.net/\n>>> Last update of WHOIS database: 2025-03-26T07:40:20Z <<< \n\nFor more information on Whois status codes, please visit https://icann.org/epp\n\n\nThe data in the Name.com, Inc. WHOIS database is provided by Name.com, Inc. for information purposes, and to assist persons in obtaining information about or related to a domain name registration record. Name.com, Inc. does not guarantee its accuracy.  Users accessing the Name.com, Inc. WHOIS service agree to use the data only for lawful purposes, and under no circumstances may this data be used to: a) allow, enable, or otherwise support the transmission by e-mail, telephone, or facsimile of mass unsolicited, commercial advertising or solicitations to entities other than the registrar's own existing customers and b) enable high volume, automated, electronic processes that send queries or data to the systems of Name.com, Inc., except as reasonably necessary to register domain names or modify existing registrations. When using the Name.com, Inc. WHOIS service, please consider the following: the WHOIS service is not a replacement for standard EPP commands to the SRS service. WHOIS is not considered authoritative for registered domain objects. The WHOIS service may be scheduled for downtime during production or OT&E maintenance periods. Where applicable, the presence of a [Non-Public Data] tag indicates that such data is not made publicly available due to applicable data privacy laws or requirements.  Access to non-public data may be provided, upon request, where it can be reasonably confirmed that the requester holds a specific legitimate interest and a proper legal basis, for accessing the withheld data. Access to this data can be requested by submitting a request via the form found at https://www.name.com/layered-access-request . Name.com, Inc. reserves the right to modify these terms at any time. By submitting this query, you agree to abide by this policy.\n\n\n\n"
  },
  {
    "domain": "dztu.com",
    "registrar": "Name.com, Inc.",
    "creation_date": "2007-05-10T14:33:04Z",
    "expiration_date": "2025-05-10T14:33:04Z",
    "updated_date": "2024-06-20T15:55:13Z",
    "name_servers": [
      "ns1.mytrafficmanagement.com",
      "ns2.mytrafficmanagement.com"
    ],
    "status": "clientTransferProhibited https://www.icann.org/epp#clientTransferProhibited",
    "raw_data": "Domain Name: DZTU.COM \nRegistry Domain ID: 968154907_DOMAIN_COM-VRSN \nRegistrar WHOIS Server: whois.name.com \nRegistrar URL: http://www.name.com \nUpdated Date: 2024-06-20T15:55:13Z \nCreation Date: 2007-05-10T14:33:04Z \nRegistrar Registration Expiration Date: 2025-05-10T14:33:04Z \nRegistrar: Name.com, Inc. \nRegistrar IANA ID: 625 \nReseller:  \nDomain Status: clientTransferProhibited https://www.icann.org/epp#clientTransferProhibited \nRegistry Registrant ID: Not Available From Registry \nRegistrant Name: Redacted For Privacy \nRegistrant Organization: Domain Protection Services, Inc. \nRegistrant Street: PO Box 1769  \nRegistrant City: Denver \nRegistrant State/Province: CO \nRegistrant Postal Code: 80201 \nRegistrant Country: US \nRegistrant Phone: +1.7208009072 \nRegistrant Fax: +1.7209758725 \nRegistrant Email: https://www.name.com/contact-domain-whois/dztu.com \nRegistry Admin ID: Not Available From Registry \nAdmin Name: Redacted For Privacy \nAdmin Organization: Domain Protection Services, Inc. \nAdmin Street: PO Box 1769  \nAdmin City: Denver \nAdmin State/Province: CO \nAdmin Postal Code: 80201 \nAdmin Country: US \nAdmin Phone: +1.7208009072 \nAdmin Fax: +1.7209758725 \nAdmin Email: https://www.name.com/contact-domain-whois/dztu.com \nRegistry Tech ID: Not Available From Registry \nTech Name: Redacted For Privacy \nTech Organization: Domain Protection Services, Inc. \nTech Street: PO Box 1769  \nTech City: Denver \nTech State/Province: CO \nTech Postal Code: 80201 \nTech Country: US \nTech Phone: +1.7208009072 \nTech Fax: +1.7209758725 \nTech Email: https://www.name.com/contact-domain-whois/dztu.com \nName Server: ns1.mytrafficmanagement.com \nName Server: ns2.mytrafficmanagement.com \nDNSSEC: unSigned \nRegistrar Abuse Contact Email: abuse@name.com \nRegistrar Abuse Contact Phone: +1.7203101849 \nURL of the ICANN WHOIS Data Problem Reporting System: http://wdprs.internic.net/\n>>> Last update of WHOIS database: 2025-03-26T07:40:23Z <<< \n\nFor more information on Whois status codes, please visit https://icann.org/epp\n\n\nThe data in the Name.com, Inc. WHOIS database is provided by Name.com, Inc. for information purposes, and to assist persons in obtaining information about or related to a domain name registration record. Name.com, Inc. does not guarantee its accuracy.  Users accessing the Name.com, Inc. WHOIS service agree to use the data only for lawful purposes, and under no circumstances may this data be used to: a) allow, enable, or otherwise support the transmission by e-mail, telephone, or facsimile of mass unsolicited, commercial advertising or solicitations to entities other than the registrar's own existing customers and b) enable high volume, automated, electronic processes that send queries or data to the systems of Name.com, Inc., except as reasonably necessary to register domain names or modify existing registrations. When using the Name.com, Inc. WHOIS service, please consider the following: the WHOIS service is not a replacement for standard EPP commands to the SRS service. WHOIS is not considered authoritative for registered domain objects. The WHOIS service may be scheduled for downtime during production or OT&E maintenance periods. Where applicable, the presence of a [Non-Public Data] tag indicates that such data is not made publicly available due to applicable data privacy laws or requirements.  Access to non-public data may be provided, upon request, where it can be reasonably confirmed that the requester holds a specific legitimate interest and a proper legal basis, for accessing the withheld data. Access to this data can be requested by submitting a request via the form found at https://www.name.com/layered-access-request . Name.com, Inc. reserves the right to modify these terms at any time. By submitting this query, you agree to abide by this policy.\n\n\n\n"
  },
  {
    "domain": "giyc.com",
    "registrar": "ENOM, INC.",
    "creation_date": "2002-05-05T13:33:00.00Z",
    "expiration_date": "2025-05-05T13:33:56.00Z",
    "updated_date": "2024-05-04T09:25:10.00Z",
    "name_servers": [
      "DILBERT.NS.CLOUDFLARE.COM",
      "TARA.NS.CLOUDFLARE.COM"
    ],
    "status": "clientTransferProhibited https://www.icann.org/epp#clientTransferProhibited",
    "raw_data": "\r\n\r\nDomain Name: giyc.com\r\nRegistry Domain ID: 86272981_DOMAIN_COM-VRSN\r\nRegistrar WHOIS Server: WHOIS.ENOM.COM\r\nRegistrar URL: WWW.ENOMDOMAINS.COM\r\nUpdated Date: 2024-05-04T09:25:10.00Z\r\nCreation Date: 2002-05-05T13:33:00.00Z\r\nRegistrar Registration Expiration Date: 2025-05-05T13:33:56.00Z\r\nRegistrar: ENOM, INC.\r\nRegistrar IANA ID: 48\r\nDomain Status: clientTransferProhibited https://www.icann.org/epp#clientTransferProhibited\r\nRegistrant Name: Whois Agent (763368273)\r\nRegistrant Organization: Whois Privacy Protection Service, Inc.\r\nRegistrant Street: PO Box 639\r\nRegistrant Street: C/O giyc.com\r\nRegistrant City: Kirkland\r\nRegistrant State/Province: WA\r\nRegistrant Postal Code: 98083\r\nRegistrant Country: US\r\nRegistrant Phone: +1.4252740657\r\nRegistrant Phone Ext: \r\nRegistrant Fax: +1.4259744730\r\nRegistrant Email: pqmdrybbt@whoisprivacyprotect.com\r\nAdmin Name: Whois Agent\r\nAdmin Organization: Whois Privacy Protection Service, Inc.\r\nAdmin Street: PO Box 639\r\nAdmin Street: C/O giyc.com\r\nAdmin City: Kirkland\r\nAdmin State/Province: WA\r\nAdmin Postal Code: 98083\r\nAdmin Country: US\r\nAdmin Phone: +1.4252740657\r\nAdmin Phone Ext: \r\nAdmin Fax: +1.4259744730\r\nAdmin Email: pqmdrybbt@whoisprivacyprotect.com\r\nTech Name: Whois Agent\r\nTech Organization: Whois Privacy Protection Service, Inc.\r\nTech Street: PO Box 639\r\nTech Street: C/O giyc.com\r\nTech City: Kirkland\r\nTech State/Province: WA\r\nTech Postal Code: 98083\r\nTech Country: US\r\nTech Phone: +1.4252740657\r\nTech Phone Ext: \r\nTech Fax: +1.4259744730\r\nTech Email: pqmdrybbt@whoisprivacyprotect.com\r\nName Server: DILBERT.NS.CLOUDFLARE.COM\r\nName Server: TARA.NS.CLOUDFLARE.COM\r\nDNSSEC: unsigned\r\nRegistrar Abuse Contact Email: ABUSE@ENOM.COM\r\nRegistrar Abuse Contact Phone: +1.4259744689\r\nURL of the ICANN WHOIS Data Problem Reporting System: HTTPS://ICANN.ORG/WICF\r\n>>> Last update of WHOIS database: 2025-03-26T07:40:26.00Z <<<\r\n\r\nFor more information on Whois status codes, please visit https://icann.org/epp\r\n\r\n\r\nThe data in this whois database is provided to you for information\r\npurposes only, that is, to assist you in obtaining information about or\r\nrelated to a domain name registration record. We make this information\r\navailable \"as is,\" and do not guarantee its accuracy. By submitting a\r\nwhois query, you agree that you will use this data only for lawful\r\npurposes and that, under no circumstances will you use this data to: (1)\r\nenable high volume, automated, electronic processes that stress or load\r\nthis whois database system providing you this information; or (2) allow,\r\nenable, or otherwise support the transmission of mass unsolicited,\r\ncommercial advertising or solicitations via direct mail, electronic\r\nmail, or by telephone. The compilation, repackaging, dissemination or\r\nother use of this data is expressly prohibited without prior written\r\nconsent from us.  \r\n\r\nWe reserve the right to modify these terms at any time. By submitting \r\nthis query, you agree to abide by these terms.\r\nVersion 6.3 4/3/2002\r\n"
  },
  {
    "domain": "wwyp.com",
    "registrar": "DDD TECHNOLOGY PTE. LTD.",
    "creation_date": "2000-04-30T16:34:56Z",
    "expiration_date": "2025-04-30T16:34:56Z",
    "updated_date": "2024-04-02T08:04:25Z",
    "name_servers": [
      "peel.ddddns.net",
      "tomato.ddddns.net"
    ],
    "status": "ok (https://www.icann.org/epp#ok)",
    "raw_data": "Domain Name: wwyp.com\r\nRegistrar WHOIS Server: whois.ddd.com\r\nRegistrar URL: https://www.ddd.com\r\nUpdated Date: 2024-04-02T08:04:25Z\r\nCreation Date: 2000-04-30T16:34:56Z\r\nRegistrar Registration Expiration Date: 2025-04-30T16:34:56Z\r\nRegistrar: DDD TECHNOLOGY PTE. LTD.\r\nRegistrar IANA ID: 3247\r\nRegistrar Abuse Contact Email: abuse@ddd.com\r\nRegistrar Abuse Contact Phone: +65-97263465\r\nDomain Status: ok (https://www.icann.org/epp#ok)\r\nRegistry Registrant ID: Redacted for privacy\r\nRegistrant Name: Redacted for privacy\r\nRegistrant Organization: Redacted for privacy\r\nRegistrant Street: Redacted for privacy\r\nRegistrant City: Redacted for privacy\r\nRegistrant State/Province: guangdongsheng\r\nRegistrant Postal Code: Redacted for privacy\r\nRegistrant Country: CN\r\nRegistrant Phone: Redacted for privacy\r\nRegistrant Phone Ext: Redacted for privacy\r\nRegistrant Fax: Redacted for privacy\r\nRegistrant Fax Ext: Redacted for privacy\r\nRegistrant Email: https://www.ddd.com/whois/contact/wwyp.com\r\nRegistry Admin ID: Redacted for privacy\r\nAdmin Name: Redacted for privacy\r\nAdmin Organization: Redacted for privacy\r\nAdmin Street: Redacted for privacy\r\nAdmin City: Redacted for privacy\r\nAdmin State/Province: Redacted for privacy\r\nAdmin Postal Code: Redacted for privacy\r\nAdmin Country: Redacted for privacy\r\nAdmin Phone: Redacted for privacy\r\nAdmin Phone Ext: Redacted for privacy\r\nAdmin Fax: Redacted for privacy\r\nAdmin Fax Ext: Redacted for privacy\r\nAdmin Email: https://www.ddd.com/whois/contact/wwyp.com\r\nRegistry Tech ID: Redacted for privacy\r\nTech Name: Redacted for privacy\r\nTech Organization: Redacted for privacy\r\nTech Street: Redacted for privacy\r\nTech City: Redacted for privacy\r\nTech State/Province: Redacted for privacy\r\nTech Postal Code: Redacted for privacy\r\nTech Country: Redacted for privacy\r\nTech Phone: Redacted for privacy\r\nTech Phone Ext: Redacted for privacy\r\nTech Fax: Redacted for privacy\r\nTech Fax Ext: Redacted for privacy\r\nTech Email: https://www.ddd.com/whois/contact/wwyp.com\r\nName Server: peel.ddddns.net\r\nName Server: tomato.ddddns.net\r\nDNSSEC: unsigned\r\nURL of the ICANN WHOIS Data Problem Reporting System: http://wdprs.internic.net/\r\n>>> Last update of WHOIS database: 2025-03-26T07:40:28Z <<<\r\nFor more information on WHOIS status codes, please visit:https://www.icann.org/resources/pages/epp-status-codes-list2014-06-18-en"
  },
  {
    "domain": "zduo.com",
    "registrar": "eName Technology Co.,Ltd.",
    "creation_date": "2005-04-29T19:55:00Z",
    "expiration_date": "2025-04-29T19:55:00Z",
    "updated_date": "2024-04-15T08:32:17Z",
    "name_servers": [
      "ns3.dns.com",
      "ns4.dns.com"
    ],
    "status": [
      "clientDeleteProhibited https://www.icann.org/epp#clientDeleteProhibited",
      "clientTransferProhibited https://www.icann.org/epp#clientTransferProhibited"
    ],
    "raw_data": "Domain Name: zduo.com\nRegistry Domain ID: 153619892_DOMAIN_COM-VRSN\nRegistrar WHOIS Server: whois.ename.com\nRegistrar URL: http://www.ename.net\nUpdated Date: 2024-04-15T08:32:17Z\nCreation Date: 2005-04-29T19:55:00Z\nRegistrar Registration Expiration Date: 2025-04-29T19:55:00Z\nRegistrar: eName Technology Co.,Ltd.\nRegistrar IANA ID: 1331\nRegistrar Abuse Contact Email: abuse@ename.com\nRegistrar Abuse Contact Phone: +86.4000044400\nDomain Status: clientDeleteProhibited https://www.icann.org/epp#clientDeleteProhibited\nDomain Status: clientTransferProhibited https://www.icann.org/epp#clientTransferProhibited\nRegistrant State/Province: GuangDong\nRegistrant Country: CN\nRegistrant Email: https://whois.ename.net/contact/zduo.com\nAdmin Email: https://whois.ename.net/contact/zduo.com\nTech Email: https://whois.ename.net/contact/zduo.com\nName Server:ns3.dns.com\nName Server:ns4.dns.com\nDNSSEC: unsigned\nURL of the ICANN WHOIS Data Problem Reporting System: http://wdprs.internic.net/\n>>> Last update of WHOIS database: 2025-03-26T15:40:32Z <<<\n\nFor more information on Whois status codes, please visit \nhttps://www.icann.org/resources/pages/epp-status-codes-2014-06-16-en\n"
  },
  {
    "domain": "coez.com",
    "registrar": "Epik LLC",
    "creation_date": "2003-04-20T03:03:27Z",
    "expiration_date": "2025-04-20T03:03:27Z",
    "updated_date": "2025-01-06T19:41:19Z",
    "name_servers": [
      "NS3.EPIK.COM",
      "NS4.EPIK.COM"
    ],
    "status": "clientTransferProhibited https://icann.org/epp#clientTransferProhibited",
    "raw_data": "Domain Name: COEZ.COM\nRegistry Domain ID: 97012777_DOMAIN_COM-VRSN\nRegistrar WHOIS Server: whois.epik.com\nRegistrar URL: http://www.epik.com\nUpdated Date: 2025-01-06T19:41:19Z\nCreation Date: 2003-04-20T03:03:27Z\nRegistrar Registration Expiration Date: 2025-04-20T03:03:27Z\nRegistrar: Epik LLC\nRegistrar IANA ID: 617\nRegistrar Abuse Contact Email: abuse@epik.com\nRegistrar Abuse Contact Phone: +1.7373015923\nDomain Status: clientTransferProhibited https://icann.org/epp#clientTransferProhibited\nRegistrant Name: Privacy Administrator\nRegistrant Organization: Anonymize, LLC.\nRegistrant Street: 30 N. Gould Street, Ste E\nRegistrant City: Sheridan\nRegistrant State/Province: WY\nRegistrant Postal Code: 82801\nRegistrant Country: US\nRegistrant Phone: +1.3076839553\nRegistrant Phone Ext: \nRegistrant Fax: \nRegistrant Fax Ext: \nRegistrant Email: coez.com-t49k9turmdkl@anonymize.com\nAdmin Name: Privacy Administrator\nAdmin Organization: Anonymize, Inc.\nAdmin Street: 30 N. Gould Street, Ste E\nAdmin City: Sheridan\nAdmin State/Province: WY\nAdmin Postal Code: 82801\nAdmin Country: US\nAdmin Phone: +1.3076839553\nAdmin Phone Ext: \nAdmin Fax: \nAdmin Fax Ext: \nAdmin Email: coez.com-t49k9turmdkl@anonymize.com\nTech Name: Privacy Administrator\nTech Organization: Anonymize, Inc.\nTech Street: 30 N. Gould Street, Ste E\nTech City: Sheridan\nTech State/Province: WY\nTech Postal Code: 82801\nTech Country: US\nTech Phone: +1.3076839553\nTech Phone Ext: \nTech Fax: \nTech Fax Ext: \nTech Email: coez.com-t49k9turmdkl@anonymize.com\nName Server: NS3.EPIK.COM\nName Server: NS4.EPIK.COM\nDNSSEC: signedDelegation\nURL of the ICANN WHOIS Data Problem Reporting System: https://wdprs.internic.net/\n>>> Last update of WHOIS database: 2024-11-21T07:28:00.000Z <<<\n\nAll registrar data, including registrant WHOIS data, is provided for public, non-commerical use only.  Any information made available by Epik Inc and its affiliate registrars shall not be collected, distributed or used for any commercial activity.  Third parties to agree not to use the data to allow, enable, or otherwise support any marketing activities, regardless of the medium used. Such media include but are not limited to e-mail, telephone, facsimile, postal mail, SMS, and wireless alerts.\nWHOIS Version: 876b28bf2a9ee22a803162aca713444b4fff6a78\n"
  },
  {
    "domain": "zmwg.com",
    "registrar": "Xiamen 35.com Information Co., Ltd.",
    "creation_date": "2005-04-16T02:27:38Z",
    "expiration_date": "2025-04-16T04:00:00Z",
    "updated_date": "2024-10-09T06:39:42Z",
    "name_servers": [
      "ns1.dns-diy.com",
      "ns2.dns-diy.com"
    ],
    "status": "clientTransferProhibited https://icann.org/epp#clientTransferProhibited",
    "raw_data": "\nDomain Name: zmwg.com\nRegistry Domain ID: 151203690_DOMAIN_COM-VRSN\nRegistrar WHOIS Server: whois.35.com\nRegistrar URL: https://www.35.com\nUpdated Date: 2024-10-09T06:39:42Z\nCreation Date: 2005-04-16T02:27:38Z\nRegistrar Registration Expiration Date: 2025-04-16T04:00:00Z\nRegistrar: Xiamen 35.com Information Co., Ltd.\nRegistrar IANA ID: 4163\nRegistrar Abuse Contact Email: domainabuse@35.cn\nRegistrar Abuse Contact Phone: +86.4001353511\nReseller: \nDomain Status: clientTransferProhibited https://icann.org/epp#clientTransferProhibited\nRegistry Registrant ID: Not Available From Registry\nRegistrant City: taizhou\nRegistrant State/Province: zhejiang\nRegistrant Country: CN\nRegistrant Email: https://rdap.35.com/contact/domain/zmwg.com\nAdmin Email: https://rdap.35.com/contact/domain/zmwg.com\nTech Email: https://rdap.35.com/contact/domain/zmwg.com\nName Server: ns1.dns-diy.com\nName Server: ns2.dns-diy.com\nDNSSEC: unsigned\nURL of the ICANN Whois Inaccuracy Complaint Form: https://www.icann.org/wicf/\n>>> Last update of whois database: 2025-03-26T07:40:38Z <<<\n For more information on Whois status codes, please visit https://icann.org/epp\nThis data is provided by Xiamen 35.Com Technology Co., Ltd for information purposes, and to assist persons obtaining information about or related to domain name registration records. 35 Technology Co., Ltd. does not guarantee its accuracy. By submitting a WHOIS query, you agree that you will use this data only for lawful purposes and that, under no circumstances, you will use this data to 1) allow, enable, or otherwise support the transmission of mass unsolicited, commercial advertising or solicitations via E-mail (spam); or 2) enable high volume, automated, electronic processes that apply to this WHOIS server. These terms may be changed without prior notice. By submitting this query, you agree to abide by this policy.\n\r\n"
  },
  {
    "domain": "eput.com",
    "registrar": "Alibaba Cloud Computing Ltd. d/b/a HiChina (www.net.cn)",
    "creation_date": "2001-04-13T14:05:14Z",
    "expiration_date": "2025-04-13T14:05:14Z",
    "updated_date": "2024-04-02T04:32:03Z",
    "name_servers": [
      "NS1.PARKINGCREW.NET",
      "NS2.PARKINGCREW.NET"
    ],
    "status": "ok https://icann.org/epp#ok",
    "raw_data": "Domain Name: eput.com\r\nRegistry Domain ID: 69208075_DOMAIN_COM-VRSN\r\nRegistrar WHOIS Server: grs-whois.hichina.com\r\nRegistrar URL: http://wanwang.aliyun.com\r\nUpdated Date: 2024-04-02T04:32:03Z\r\nCreation Date: 2001-04-13T14:05:14Z\r\nRegistrar Registration Expiration Date: 2025-04-13T14:05:14Z\r\nRegistrar: Alibaba Cloud Computing Ltd. d/b/a HiChina (www.net.cn)\r\nRegistrar IANA ID: 1599\r\nReseller:\r\nDomain Status: ok https://icann.org/epp#ok\r\nRegistrant City: \r\nRegistrant State/Province: guang dong\r\nRegistrant Country: CN\r\nRegistrant Email:https://whois.aliyun.com/whois/whoisForm\r\nRegistry Registrant ID: Not Available From Registry\r\nName Server: NS1.PARKINGCREW.NET\r\nName Server: NS2.PARKINGCREW.NET\r\nDNSSEC: unsigned\r\nRegistrar Abuse Contact Email: DomainAbuse@service.aliyun.com\r\nRegistrar Abuse Contact Phone: +86.95187\r\nURL of the ICANN WHOIS Data Problem Reporting System: http://wdprs.internic.net/\r\n>>>Last update of WHOIS database: 2025-03-26T07:40:41Z <<<\r\n\r\nFor more information on Whois status codes, please visit https://icann.org/epp\r\n\r\nImportant Reminder: Per ICANN 2013RAA`s request, Hichina has modified domain names`whois format of dot com/net/cc/tv, you could refer to section 1.4 posted by ICANN on http://www.icann.org/en/resources/registrars/raa/approved-with-specs-27jun13-en.htm#whois The data in this whois database is provided to you for information purposes only, that is, to assist you in obtaining information about or related to a domain name registration record. We make this information available \"as is,\" and do not guarantee its accuracy. By submitting a whois query, you agree that you will use this data only for lawful purposes and that, under no circumstances will you use this data to: (1)enable high volume, automated, electronic processes that stress or load this whois database system providing you this information; or (2) allow, enable, or otherwise support the transmission of mass unsolicited, commercial advertising or solicitations via direct mail, electronic mail, or by telephone.  The compilation, repackaging, dissemination or other use of this data is expressly prohibited without prior written consent from us. We reserve the right to modify these terms at any time. By submitting this query, you agree to abide by these terms.For complete domain details go to:http://whois.aliyun.com/whois/domain/hichina.com\n"
  },
  {
    "domain": "xebs.com",
    "registrar": "Megazone Corp., dba HOSTING.KR",
    "creation_date": "2002-04-12T12:00:00Z",
    "expiration_date": "2025-04-12T12:00:00Z",
    "updated_date": "2024-03-29T12:00:00Z",
    "name_servers": [
      "NS2.DNSTOOL.NET",
      "NS1.DNSTOOL.NET",
      "Name Server:",
      "DNSSEC: unsigned"
    ],
    "status": "ok https://icann.org/epp#ok",
    "raw_data": "Domain Name: xebs.com\r\nRegistry Domain ID: 85534919_DOMAIN_COM-VRSN\r\nRegistrar WHOIS Server: whois.hosting.kr\r\nRegistrar URL: http://www.hosting.kr\r\nUpdated Date: 2024-03-29T12:00:00Z\r\nCreation Date: 2002-04-12T12:00:00Z\r\nRegistrar Registration Expiration Date: 2025-04-12T12:00:00Z\r\nRegistrar: Megazone Corp., dba HOSTING.KR\r\nRegistrar IANA ID: 1489\r\nRegistrar Abuse Contact Email: abuse@hosting.kr\r\nRegistrar Abuse Contact Phone: +82.216447378\r\nReseller:\r\nDomain Status: ok https://icann.org/epp#ok\r\nRegistry Registrant ID: Not Available From Registry\r\nRegistrant Name: Byungil Ahn\r\nRegistrant Organization: Byungil Ahn\r\nRegistrant Street: Daerim Apt 101-1102 140 Ilhyeon-ro, Ilsanseo-gu Goyang-si\r\nRegistrant City: Gyeonggi-do\r\nRegistrant State/Province:\r\nRegistrant Postal Code: 10239\r\nRegistrant Country: KR\r\nRegistrant Phone: +82.1027972290\r\nRegistrant Phone Ext:\r\nRegistrant Fax: \r\nRegistrant Fax Ext:\r\nRegistrant Email: brainstv@gmail.com\r\nRegistry Admin ID: Not Available From Registry\r\nAdmin Name: Byungil Ahn\r\nAdmin Organization: Byungil Ahn\r\nAdmin Street: Daerim Apt 101-1102 140 Ilhyeon-ro, Ilsanseo-gu Goyang-si\r\nAdmin City: Gyeonggi-do\r\nAdmin State/Province:\r\nAdmin Postal Code: 10239\r\nAdmin Country: KR\r\nAdmin Phone: +82.1027972290\r\nAdmin Phone Ext:\r\nAdmin Fax: \r\nAdmin Fax Ext:\r\nAdmin Email: brainstv@gmail.com\r\nRegistry Tech ID: Not Available From Registry\r\nTech Name: Byungil Ahn\r\nTech Organization: Byungil Ahn\r\nTech Street: Daerim Apt 101-1102 140 Ilhyeon-ro, Ilsanseo-gu Goyang-si\r\nTech City: Gyeonggi-do\r\nTech State/Province:\r\nTech Postal Code: 10239\r\nTech Country: KR\r\nTech Phone: +82.1027972290\r\nTech Phone Ext:\r\nTech Fax: \r\nTech Fax Ext:\r\nTech Email: brainstv@gmail.com\r\nName Server: NS2.DNSTOOL.NET\r\nName Server: NS1.DNSTOOL.NET\r\nName Server: \r\nName Server: \r\nName Server: \r\nDNSSEC: unsigned\r\nURL of the ICANN WHOIS Data Problem Reporting System: http://wdprs.internic.net/\r\n>>> Last update of WHOIS database: 2024-03-29T12:00:00Z <<<\r\n\r\nFor more information on Whois status codes, please visit https://icann.org/epp\r\n\r\nWelcome to Megazone Corp. dba hosting.kr WHOIS data service.\r\n\r\nThe data contained in hosting.kr's WhoIs database.\r\nMegazone Corp. does not guarantee accuracy for WHOIS.\r\nThis information is provided for the sole purpose of assisting you in\r\nobtaining information about domain name registration records.\r\n\r\nMegazone Corp. is Domain & Hosting provider, very huge web agency Company, \r\nNo. 1 in Korea and operating \"Online Marketing & Promotion\", \"3D & Motion\", \r\n\"eCommerce\" and \"Web Portal Service\". We offer all service regarding \r\nInformation Technical and we have many experience for domain & hosting and \r\nweb agency solution. If you want to find partner of IT industry, \r\ncontact Megazone Corp. dba hosting.kr.\r\n\r\nWe are creating high value service and low in price for domain \r\n& hosting providing. Obtain good service for domain name registration, \r\ntransfer or renewal with any hosting package with <a href=\"http://www.hosting.kr\">http://www.hosting.kr</a>\r\n\r\nThank you for finding domain name of hosting.kr    \r\n"
  },
  {
    "domain": "ljom.com",
    "registrar": "Name.com, Inc.",
    "creation_date": "2006-03-29T06:24:55Z",
    "expiration_date": "2025-03-29T05:24:55Z",
    "updated_date": "2024-05-08T17:24:43Z",
    "name_servers": [
      "ns1.mytrafficmanagement.com",
      "ns2.mytrafficmanagement.com"
    ],
    "status": "clientTransferProhibited https://www.icann.org/epp#clientTransferProhibited",
    "raw_data": "Domain Name: LJOM.COM \nRegistry Domain ID: 393115602_DOMAIN_COM-VRSN \nRegistrar WHOIS Server: whois.name.com \nRegistrar URL: http://www.name.com \nUpdated Date: 2024-05-08T17:24:43Z \nCreation Date: 2006-03-29T06:24:55Z \nRegistrar Registration Expiration Date: 2025-03-29T05:24:55Z \nRegistrar: Name.com, Inc. \nRegistrar IANA ID: 625 \nReseller:  \nDomain Status: clientTransferProhibited https://www.icann.org/epp#clientTransferProhibited \nRegistry Registrant ID: Not Available From Registry \nRegistrant Name: Redacted For Privacy \nRegistrant Organization: Domain Protection Services, Inc. \nRegistrant Street: PO Box 1769  \nRegistrant City: Denver \nRegistrant State/Province: CO \nRegistrant Postal Code: 80201 \nRegistrant Country: US \nRegistrant Phone: +1.7208009072 \nRegistrant Fax: +1.7209758725 \nRegistrant Email: https://www.name.com/contact-domain-whois/ljom.com \nRegistry Admin ID: Not Available From Registry \nAdmin Name: Redacted For Privacy \nAdmin Organization: Domain Protection Services, Inc. \nAdmin Street: PO Box 1769  \nAdmin City: Denver \nAdmin State/Province: CO \nAdmin Postal Code: 80201 \nAdmin Country: US \nAdmin Phone: +1.7208009072 \nAdmin Fax: +1.7209758725 \nAdmin Email: https://www.name.com/contact-domain-whois/ljom.com \nRegistry Tech ID: Not Available From Registry \nTech Name: Redacted For Privacy \nTech Organization: Domain Protection Services, Inc. \nTech Street: PO Box 1769  \nTech City: Denver \nTech State/Province: CO \nTech Postal Code: 80201 \nTech Country: US \nTech Phone: +1.7208009072 \nTech Fax: +1.7209758725 \nTech Email: https://www.name.com/contact-domain-whois/ljom.com \nName Server: ns1.mytrafficmanagement.com \nName Server: ns2.mytrafficmanagement.com \nDNSSEC: unSigned \nRegistrar Abuse Contact Email: abuse@name.com \nRegistrar Abuse Contact Phone: +1.7203101849 \nURL of the ICANN WHOIS Data Problem Reporting System: http://wdprs.internic.net/\n>>> Last update of WHOIS database: 2025-03-26T07:40:47Z <<< \n\nFor more information on Whois status codes, please visit https://icann.org/epp\n\n\nThe data in the Name.com, Inc. WHOIS database is provided by Name.com, Inc. for information purposes, and to assist persons in obtaining information about or related to a domain name registration record. Name.com, Inc. does not guarantee its accuracy.  Users accessing the Name.com, Inc. WHOIS service agree to use the data only for lawful purposes, and under no circumstances may this data be used to: a) allow, enable, or otherwise support the transmission by e-mail, telephone, or facsimile of mass unsolicited, commercial advertising or solicitations to entities other than the registrar's own existing customers and b) enable high volume, automated, electronic processes that send queries or data to the systems of Name.com, Inc., except as reasonably necessary to register domain names or modify existing registrations. When using the Name.com, Inc. WHOIS service, please consider the following: the WHOIS service is not a replacement for standard EPP commands to the SRS service. WHOIS is not considered authoritative for registered domain objects. The WHOIS service may be scheduled for downtime during production or OT&E maintenance periods. Where applicable, the presence of a [Non-Public Data] tag indicates that such data is not made publicly available due to applicable data privacy laws or requirements.  Access to non-public data may be provided, upon request, where it can be reasonably confirmed that the requester holds a specific legitimate interest and a proper legal basis, for accessing the withheld data. Access to this data can be requested by submitting a request via the form found at https://www.name.com/layered-access-request . Name.com, Inc. reserves the right to modify these terms at any time. By submitting this query, you agree to abide by this policy.\n\n\n\n"
  },
  {
    "domain": "guib.com",
    "registrar": "Megazone Corp., dba HOSTING.KR",
    "creation_date": "2003-03-27T12:00:00Z",
    "expiration_date": "2025-03-27T12:00:00Z",
    "updated_date": "2024-03-22T12:00:00Z",
    "name_servers": [
      "NS1.SEDOPARKING.COM",
      "NS2.SEDOPARKING.COM",
      "Name Server:",
      "DNSSEC: unsigned"
    ],
    "status": "ok https://icann.org/epp#ok",
    "raw_data": "Domain Name: guib.com\r\nRegistry Domain ID: 96218647_DOMAIN_COM-VRSN\r\nRegistrar WHOIS Server: whois.hosting.kr\r\nRegistrar URL: http://www.hosting.kr\r\nUpdated Date: 2024-03-22T12:00:00Z\r\nCreation Date: 2003-03-27T12:00:00Z\r\nRegistrar Registration Expiration Date: 2025-03-27T12:00:00Z\r\nRegistrar: Megazone Corp., dba HOSTING.KR\r\nRegistrar IANA ID: 1489\r\nRegistrar Abuse Contact Email: abuse@hosting.kr\r\nRegistrar Abuse Contact Phone: +82.216447378\r\nReseller:\r\nDomain Status: ok https://icann.org/epp#ok\r\nRegistry Registrant ID: Not Available From Registry\r\nRegistrant Name: SUNGAE CHOI\r\nRegistrant Organization: SUNGAE CHOI\r\nRegistrant Street: 502 410-5, Bulgwangcheon-gil,  Eunpyeong-gu\r\nRegistrant City: Seoul\r\nRegistrant State/Province:\r\nRegistrant Postal Code: 03457\r\nRegistrant Country: KR\r\nRegistrant Phone: +82.23068500\r\nRegistrant Phone Ext:\r\nRegistrant Fax: \r\nRegistrant Fax Ext:\r\nRegistrant Email: okdnet@naver.com\r\nRegistry Admin ID: Not Available From Registry\r\nAdmin Name: SungAe Choi\r\nAdmin Organization: SungAe Choi\r\nAdmin Street: 583-36 Ritsvil 502 Eungam 3(sam)-dong Eunpyeong-gu\r\nAdmin City: Seoul\r\nAdmin State/Province:\r\nAdmin Postal Code: 03457\r\nAdmin Country: KR\r\nAdmin Phone: +82.106242211\r\nAdmin Phone Ext:\r\nAdmin Fax: \r\nAdmin Fax Ext:\r\nAdmin Email: okdnet@naver.com\r\nRegistry Tech ID: Not Available From Registry\r\nTech Name: SungAe Choi\r\nTech Organization: SungAe Choi\r\nTech Street: 583-36 Ritsvil 502 Eungam 3(sam)-dong Eunpyeong-gu\r\nTech City: Seoul\r\nTech State/Province:\r\nTech Postal Code: 03457\r\nTech Country: KR\r\nTech Phone: +82.106242211\r\nTech Phone Ext:\r\nTech Fax: \r\nTech Fax Ext:\r\nTech Email: okdnet@naver.com\r\nName Server: NS1.SEDOPARKING.COM\r\nName Server: NS2.SEDOPARKING.COM\r\nName Server: \r\nName Server: \r\nName Server: \r\nDNSSEC: unsigned\r\nURL of the ICANN WHOIS Data Problem Reporting System: http://wdprs.internic.net/\r\n>>> Last update of WHOIS database: 2024-03-22T12:00:00Z <<<\r\n\r\nFor more information on Whois status codes, please visit https://icann.org/epp\r\n\r\nWelcome to Megazone Corp. dba hosting.kr WHOIS data service.\r\n\r\nThe data contained in hosting.kr's WhoIs database.\r\nMegazone Corp. does not guarantee accuracy for WHOIS.\r\nThis information is provided for the sole purpose of assisting you in\r\nobtaining information about domain name registration records.\r\n\r\nMegazone Corp. is Domain & Hosting provider, very huge web agency Company, \r\nNo. 1 in Korea and operating \"Online Marketing & Promotion\", \"3D & Motion\", \r\n\"eCommerce\" and \"Web Portal Service\". We offer all service regarding \r\nInformation Technical and we have many experience for domain & hosting and \r\nweb agency solution. If you want to find partner of IT industry, \r\ncontact Megazone Corp. dba hosting.kr.\r\n\r\nWe are creating high value service and low in price for domain \r\n& hosting providing. Obtain good service for domain name registration, \r\ntransfer or renewal with any hosting package with <a href=\"http://www.hosting.kr\">http://www.hosting.kr</a>\r\n\r\nThank you for finding domain name of hosting.kr    \r\n"
  },
  {
    "domain": "aayq.com",
    "registrar": "Alibaba Cloud Computing (Beijing) Co., Ltd.",
    "creation_date": "2014-03-26T18:42:37Z",
    "expiration_date": "2025-03-26T18:42:37Z",
    "updated_date": "2024-08-07T15:57:42Z",
    "name_servers": [
      "NS1.DAN.COM",
      "NS2.DAN.COM"
    ],
    "status": "ok https://icann.org/epp#ok",
    "raw_data": "Domain Name: aayq.com\r\nRegistry Domain ID: 1852118144_DOMAIN_COM-VRSN\r\nRegistrar WHOIS Server: grs-whois.hichina.com\r\nRegistrar URL: http://www.net.cn\r\nUpdated Date: 2024-08-07T15:57:42Z\r\nCreation Date: 2014-03-26T18:42:37Z\r\nRegistrar Registration Expiration Date: 2025-03-26T18:42:37Z\r\nRegistrar: Alibaba Cloud Computing (Beijing) Co., Ltd.\r\nRegistrar IANA ID: 420\r\nReseller:\r\nDomain Status: ok https://icann.org/epp#ok\r\nRegistrant City: \r\nRegistrant State/Province: bei jing\r\nRegistrant Country: CN\r\nRegistrant Email:https://whois.aliyun.com/whois/whoisForm\r\nRegistry Registrant ID: Not Available From Registry\r\nName Server: NS1.DAN.COM\r\nName Server: NS2.DAN.COM\r\nDNSSEC: unsigned\r\nRegistrar Abuse Contact Email: DomainAbuse@service.aliyun.com\r\nRegistrar Abuse Contact Phone: +86.95187\r\nURL of the ICANN WHOIS Data Problem Reporting System: http://wdprs.internic.net/\r\n>>>Last update of WHOIS database: 2025-03-26T07:40:52Z <<<\r\n\r\nFor more information on Whois status codes, please visit https://icann.org/epp\r\n\r\nImportant Reminder: Per ICANN 2013RAA`s request, Hichina has modified domain names`whois format of dot com/net/cc/tv, you could refer to section 1.4 posted by ICANN on http://www.icann.org/en/resources/registrars/raa/approved-with-specs-27jun13-en.htm#whois The data in this whois database is provided to you for information purposes only, that is, to assist you in obtaining information about or related to a domain name registration record. We make this information available \"as is,\" and do not guarantee its accuracy. By submitting a whois query, you agree that you will use this data only for lawful purposes and that, under no circumstances will you use this data to: (1)enable high volume, automated, electronic processes that stress or load this whois database system providing you this information; or (2) allow, enable, or otherwise support the transmission of mass unsolicited, commercial advertising or solicitations via direct mail, electronic mail, or by telephone.  The compilation, repackaging, dissemination or other use of this data is expressly prohibited without prior written consent from us. We reserve the right to modify these terms at any time. By submitting this query, you agree to abide by these terms.For complete domain details go to:http://whois.aliyun.com/whois/domain/hichina.com\n"
  },
  {
    "domain": "gtxp.com",
    "registrar": "ENOM, INC.",
    "creation_date": "2004-03-25T19:10:59.00Z",
    "expiration_date": "2025-03-25T18:10:59.00Z",
    "updated_date": "2025-03-26T07:36:27.00Z",
    "name_servers": [
      "DNS1.NAME-SERVICES.COM",
      "DNS2.NAME-SERVICES.COM",
      "DNS3.NAME-SERVICES.COM",
      "DNS4.NAME-SERVICES.COM",
      "DNS5.NAME-SERVICES.COM"
    ],
    "status": [
      "clientDeleteProhibited https://www.icann.org/epp#clientDeleteProhibited",
      "autoRenewPeriod https://www.icann.org/epp#autoRenewPeriod",
      "clientTransferProhibited https://www.icann.org/epp#clientTransferProhibited"
    ],
    "raw_data": "\r\n\r\nDomain Name: gtxp.com\r\nRegistry Domain ID: 115112761_DOMAIN_COM-VRSN\r\nRegistrar WHOIS Server: WHOIS.ENOM.COM\r\nRegistrar URL: WWW.ENOMDOMAINS.COM\r\nUpdated Date: 2025-03-26T07:36:27.00Z\r\nCreation Date: 2004-03-25T19:10:59.00Z\r\nRegistrar Registration Expiration Date: 2025-03-25T18:10:59.00Z\r\nRegistrar: ENOM, INC.\r\nRegistrar IANA ID: 48\r\nDomain Status: clientDeleteProhibited https://www.icann.org/epp#clientDeleteProhibited\r\nDomain Status: autoRenewPeriod https://www.icann.org/epp#autoRenewPeriod\r\nDomain Status: clientTransferProhibited https://www.icann.org/epp#clientTransferProhibited\r\nRegistrant Name: REDACTED FOR PRIVACY\r\nRegistrant Organization: REDACTED FOR PRIVACY\r\nRegistrant Street: REDACTED FOR PRIVACY\r\nRegistrant Street: \r\nRegistrant City: REDACTED FOR PRIVACY\r\nRegistrant State/Province: \r\nRegistrant Postal Code: REDACTED FOR PRIVACY\r\nRegistrant Country: US\r\nRegistrant Phone: REDACTED FOR PRIVACY\r\nRegistrant Phone Ext: \r\nRegistrant Fax: REDACTED FOR PRIVACY\r\nRegistrant Email: https://tieredaccess.com/contact/5bd67d77-3a7c-45d6-ae00-3641f34b2d97\r\nAdmin Name: REDACTED FOR PRIVACY\r\nAdmin Organization: REDACTED FOR PRIVACY\r\nAdmin Street: REDACTED FOR PRIVACY\r\nAdmin Street: \r\nAdmin City: REDACTED FOR PRIVACY\r\nAdmin State/Province: REDACTED FOR PRIVACY\r\nAdmin Postal Code: REDACTED FOR PRIVACY\r\nAdmin Country: REDACTED FOR PRIVACY\r\nAdmin Phone: REDACTED FOR PRIVACY\r\nAdmin Phone Ext: \r\nAdmin Fax: REDACTED FOR PRIVACY\r\nAdmin Email: REDACTED FOR PRIVACY\r\nTech Name: REDACTED FOR PRIVACY\r\nTech Organization: REDACTED FOR PRIVACY\r\nTech Street: REDACTED FOR PRIVACY\r\nTech Street: \r\nTech City: REDACTED FOR PRIVACY\r\nTech State/Province: REDACTED FOR PRIVACY\r\nTech Postal Code: REDACTED FOR PRIVACY\r\nTech Country: REDACTED FOR PRIVACY\r\nTech Phone: REDACTED FOR PRIVACY\r\nTech Phone Ext: \r\nTech Fax: REDACTED FOR PRIVACY\r\nTech Email: REDACTED FOR PRIVACY\r\nName Server: DNS1.NAME-SERVICES.COM\r\nName Server: DNS2.NAME-SERVICES.COM\r\nName Server: DNS3.NAME-SERVICES.COM\r\nName Server: DNS4.NAME-SERVICES.COM\r\nName Server: DNS5.NAME-SERVICES.COM\r\nDNSSEC: unsigned\r\nRegistrar Abuse Contact Email: ABUSE@ENOM.COM\r\nRegistrar Abuse Contact Phone: +1.4259744689\r\nURL of the ICANN WHOIS Data Problem Reporting System: HTTPS://ICANN.ORG/WICF\r\n>>> Last update of WHOIS database: 2025-03-26T07:40:55.00Z <<<\r\n\r\nFor more information on Whois status codes, please visit https://icann.org/epp\r\n\r\n\r\nThe data in this whois database is provided to you for information\r\npurposes only, that is, to assist you in obtaining information about or\r\nrelated to a domain name registration record. We make this information\r\navailable \"as is,\" and do not guarantee its accuracy. By submitting a\r\nwhois query, you agree that you will use this data only for lawful\r\npurposes and that, under no circumstances will you use this data to: (1)\r\nenable high volume, automated, electronic processes that stress or load\r\nthis whois database system providing you this information; or (2) allow,\r\nenable, or otherwise support the transmission of mass unsolicited,\r\ncommercial advertising or solicitations via direct mail, electronic\r\nmail, or by telephone. The compilation, repackaging, dissemination or\r\nother use of this data is expressly prohibited without prior written\r\nconsent from us.  \r\n\r\nWe reserve the right to modify these terms at any time. By submitting \r\nthis query, you agree to abide by these terms.\r\nVersion 6.3 4/3/2002\r\n"
  },
  {
    "domain": "vgzj.com",
    "registrar": "TurnCommerce, Inc. DBA NameBright.com",
    "creation_date": "2014-01-02T19:27:29.000Z",
    "expiration_date": "2025-01-02T19:27:29.000Z",
    "updated_date": "2020-12-27T08:11:21.087Z",
    "name_servers": [
      "DOMAIN-FOR-SALE.HUGEDOMAINSDNS.COM",
      "FORSALE.HUGEDOMAINSDNS.COM"
    ],
    "status": "clientTransferProhibited https://www.icann.org/epp#clientTransferProhibited",
    "raw_data": "Domain Name: VGZJ.COM\r\nRegistry Domain ID: 1841172613_DOMAIN_COM-VRSN\r\nRegistrar WHOIS Server: whois.NameBright.com\r\nRegistrar URL: https://www.NameBright.com\r\nUpdated Date: 2020-12-27T08:11:21.087Z\r\nCreation Date: 2014-01-02T19:27:29.000Z\r\nRegistrar Registration Expiration Date: 2025-01-02T19:27:29.000Z\r\nRegistrar: TurnCommerce, Inc. DBA NameBright.com\r\nRegistrar IANA ID: 1441\r\nRegistrar Abuse Contact Email: abuse@NameBright.com\r\nRegistrar Abuse Contact Phone: +1.7204960020\r\nDomain Status: clientTransferProhibited https://www.icann.org/epp#clientTransferProhibited\r\nRegistry Registrant ID: Not Available From Registry\r\nRegistrant Name: Domain Admin / This Domain is For Sale\r\nRegistrant Organization: HugeDomains.com\r\nRegistrant Street: 2635 Walnut Street\r\nRegistrant City: Denver\r\nRegistrant State/Province: CO\r\nRegistrant Postal Code: 80205\r\nRegistrant Country: US\r\nRegistrant Phone: +1.3038930552\r\nRegistrant Phone Ext: \r\nRegistrant Fax: \r\nRegistrant Fax Ext: \r\nRegistrant Email: domains@hugedomains.com\r\nRegistry Admin ID: Not Available From Registry\r\nAdmin Name: Domain Admin / This Domain is For Sale\r\nAdmin Organization: HugeDomains.com\r\nAdmin Street: 2635 Walnut Street\r\nAdmin City: Denver\r\nAdmin State/Province: CO\r\nAdmin Postal Code: 80205\r\nAdmin Country: US\r\nAdmin Phone: +1.3038930552\r\nAdmin Phone Ext: \r\nAdmin Fax: \r\nAdmin Fax Ext: \r\nAdmin Email: domains@hugedomains.com\r\nRegistry Tech ID: Not Available From Registry\r\nTech Name: Domain Admin / This Domain is For Sale\r\nTech Organization: HugeDomains.com\r\nTech Street: 2635 Walnut Street\r\nTech City: Denver\r\nTech State/Province: CO\r\nTech Postal Code: 80205\r\nTech Country: US\r\nTech Phone: +1.3038930552\r\nTech Phone Ext: \r\nTech Fax: \r\nTech Fax Ext: \r\nTech Email: domains@hugedomains.com\r\nName Server: DOMAIN-FOR-SALE.HUGEDOMAINSDNS.COM\r\nName Server: FORSALE.HUGEDOMAINSDNS.COM\r\nDNSSEC: unsigned\r\nURL of the ICANN WHOIS Data Problem Reporting System: http://wdprs.internic.net/\r\n>>> Last update of WHOIS database: 2020-12-27T08:11:21.087Z <<<\r\n"
  },
  {
    "domain": "bthu.com",
    "registrar": "GoDaddy.com, LLC",
    "creation_date": "2011-08-01T13:32:10Z",
    "expiration_date": "2025-08-01T13:32:10Z",
    "updated_date": "2024-08-09T17:13:59Z",
    "name_servers": [
      "NS1.PARKINGCREW.NET",
      "NS2.PARKINGCREW.NET"
    ],
    "status": [
      "clientTransferProhibited https://icann.org/epp#clientTransferProhibited",
      "clientUpdateProhibited https://icann.org/epp#clientUpdateProhibited",
      "clientRenewProhibited https://icann.org/epp#clientRenewProhibited",
      "clientDeleteProhibited https://icann.org/epp#clientDeleteProhibited"
    ],
    "raw_data": "Domain Name: BTHU.COM\r\nRegistry Domain ID: 1669923405_DOMAIN_COM-VRSN\r\nRegistrar WHOIS Server: whois.godaddy.com\r\nRegistrar URL: https://www.godaddy.com\r\nUpdated Date: 2024-08-09T17:13:59Z\r\nCreation Date: 2011-08-01T13:32:10Z\r\nRegistrar Registration Expiration Date: 2025-08-01T13:32:10Z\r\nRegistrar: GoDaddy.com, LLC\r\nRegistrar IANA ID: 146\r\nRegistrar Abuse Contact Email: abuse@godaddy.com\r\nRegistrar Abuse Contact Phone: +1.4806242505\r\nDomain Status: clientTransferProhibited https://icann.org/epp#clientTransferProhibited\r\nDomain Status: clientUpdateProhibited https://icann.org/epp#clientUpdateProhibited\r\nDomain Status: clientRenewProhibited https://icann.org/epp#clientRenewProhibited\r\nDomain Status: clientDeleteProhibited https://icann.org/epp#clientDeleteProhibited\r\nRegistry Registrant ID: Not Available From Registry\r\nRegistrant Name: AskMySite.com LLC\r\nRegistrant Organization: \r\nRegistrant Street: P.O.BOX 411\r\nRegistrant City: Cresskill\r\nRegistrant State/Province: New Jersey\r\nRegistrant Postal Code: 07626\r\nRegistrant Country: US\r\nRegistrant Phone: +1.7572572392\r\nRegistrant Phone Ext:\r\nRegistrant Fax: \r\nRegistrant Fax Ext:\r\nRegistrant Email: askmysite@aol.com\r\nRegistry Tech ID: Not Available From Registry\r\nTech Name: AskMySite.com LLC\r\nTech Organization: \r\nTech Street: P.O.BOX 411\r\nTech City: Cresskill\r\nTech State/Province: New Jersey\r\nTech Postal Code: 07626\r\nTech Country: US\r\nTech Phone: +1.7572572392\r\nTech Phone Ext:\r\nTech Fax: \r\nTech Fax Ext:\r\nTech Email: askmysite@aol.com\r\nName Server: NS1.PARKINGCREW.NET\r\nName Server: NS2.PARKINGCREW.NET\r\nDNSSEC: unsigned\r\nURL of the ICANN WHOIS Data Problem Reporting System: http://wdprs.internic.net/\r\n>>> Last update of WHOIS database: 2025-03-26T07:41:00Z <<<\r\nFor more information on Whois status codes, please visit https://icann.org/epp\r\n\r\nTERMS OF USE: The data contained in this registrar's Whois database, while believed by the\r\nregistrar to be reliable, is provided \"as is\" with no guarantee or warranties regarding its\r\naccuracy. This information is provided for the sole purpose of assisting you in obtaining\r\ninformation about domain name registration records. Any use of this data for any other purpose\r\nis expressly forbidden without the prior written permission of this registrar. By submitting\r\nan inquiry, you agree to these terms and limitations of warranty. In particular, you agree not\r\nto use this data to allow, enable, or otherwise support the dissemination or collection of this\r\ndata, in part or in its entirety, for any purpose, such as transmission by e-mail, telephone,\r\npostal mail, facsimile or other means of mass unsolicited, commercial advertising or solicitations\r\nof any kind, including spam. You further agree not to use this data to enable high volume, automated\r\nor robotic electronic processes designed to collect or compile this data for any purpose, including\r\nmining this data for your own personal or commercial purposes. Failure to comply with these terms\r\nmay result in termination of access to the Whois database. These terms may be subject to modification\r\nat any time without notice.\r\n\r\n**NOTICE** This WHOIS server is being retired. Please use our RDAP service instead.\r\n\r\n"
  }
]